{
  "$schema": "../../schema-json/crew.schema.json",
  "id": "crew.tomas_ruiz",
  "name": "Tomas Ruiz",
  "roleTags": ["engineer", "deckhand"],
  "skills": {
    "engineering": 5,
    "electrical": 3,
    "cargo": 4,
    "piloting": 1,
    "medical": 1,
    "cooking": 1
  },
  "traits": ["trait.brisk_walker"],
  "startingInventory": [],
  "bio": "Second engineer and deckhand; splits time between engineering and the hold.",
  "voice": "Fast, apologetic, already walking: sentences trail off because he is halfway to the next job. Calls the captain \"Cap\" and over-explains. Cheerful about most things. Bad news comes with \"it's probably fine, but\" and three reasons it might not be, before he says what he actually saw.",
  "interests": {
    "likes": ["sparring", "cards"],
    "strong": "sparring",
    "dislikes": ["debate"]
  },
  "values": {
    "orderFreedom": 1,
    "faithReason": -1,
    "loyaltyAmbition": 0
  }
}
