{
  "$schema": "../../schema-json/crew.schema.json",
  "id": "crew.mara_osei",
  "name": "Mara Osei",
  "roleTags": ["captain"],
  "skills": {
    "piloting": 6,
    "cargo": 2,
    "engineering": 2,
    "electrical": 1,
    "medical": 1,
    "cooking": 1
  },
  "startingInventory": [
    {
      "itemDefId": "item.old_photograph",
      "count": 1
    }
  ],
  "bio": "Captain of the Freighter Mk2; ex-navy, keeps the crew's manifest by heart.",
  "voice": "Navy cadence: short declaratives, no small talk. Dry rather than wry; a joke from her is one flat word. She expects the point and gives it, decides fast and says so once, then does not revisit. The crew answer in fewer words when she is in the room, and a pause from her reads as disapproval."
}
