{
  "$schema": "../../schema-json/crew.schema.json",
  "id": "crew.sunniva_park",
  "name": "Sunniva Park",
  "roleTags": ["deckhand"],
  "skills": {
    "cargo": 8,
    "engineering": 2,
    "electrical": 1,
    "medical": 1,
    "cooking": 2,
    "piloting": 1
  },
  "startingInventory": [],
  "bio": "Cargo hand; knows exactly how to stack a hold so nothing shifts in transit.",
  "voice": "Few words, most of them nouns. Calls the captain \"Boss\". Lists what is where and what is loose, and distrusts anything that is not tied down, people included. Bad news gets a grunt, one sentence, and the strap she has already thrown over it.",
  "interests": {
    "likes": ["exercise", "sparring", "gossip"],
    "strong": "exercise",
    "dislikes": ["music"]
  },
  "values": {
    "orderFreedom": 1,
    "faithReason": 0,
    "loyaltyAmbition": 1
  }
}
